{"campaign_id":"luremandate-conformance-v1","completed_at":"2026-09-05T15:16:00Z","export_id":"luremandate-otel-conformance-1","generated_at":"2026-09-05T15:20:00Z","limitations":["strict_body_free_projection_of_the_opentelemetry_log_data_model_not_raw_otlp","custom_lurebench_event_names_and_attributes_are_not_opentelemetry_semantic_conventions","timestamps_resource_identity_and_attributes_require_external_instrumentation_assurance","only_opaque_identifiers_spiffe_ids_digests_decisions_and_bounded_impact_units_are_accepted"],"plan_sha256":"034d002b81c30e2ceeb6690c643828874cde8e1c1769015a82402c2cad401641","privacy":{"body_accepted":false,"free_text_or_transaction_content_accepted":false,"instrumentation_scope_accepted":false,"opaque_identifiers_spiffe_ids_digests_decisions_and_bounded_impact_units_only":true,"tokens_credentials_prompts_commands_payloads_hosts_urls_or_customer_content_accepted":false},"receiver":{"artifact_sha256":"aaaaaaaaaaaaaaaaaaaaaaaaaaaaaaaaaaaaaaaaaaaaaaaaaaaaaaaaaaaaaaaa","instance_id":"authority-gateway-instance-1","name":"luremandate-reference","version":"1.0.0"},"records":[{"Attributes":{"luremandate.action":"apply-change","luremandate.agent.id":"agent-a","luremandate.impact_units":10,"luremandate.intent.id":"intent-01","luremandate.intent.nonce":"intent-nonce-01","luremandate.intent.proposed_at":"2026-09-05T15:00:00Z","luremandate.intent.sha256":"d13e88ab6f40e6b0326c914d9ca68258eb066723b26b154315ea07ec06df4d6d","luremandate.policy.id":"standard-change","luremandate.requester.id":"requester-a","luremandate.resource.id":"synthetic-resource-01","luremandate.run.id":"mandate-run-1","luremandate.tenant.id":"agency-tenant","luremandate.transaction.id":"tx-01","luremandate.transaction.sequence":1,"luremandate.workload.spiffe_id":"spiffe://example.gov/workload/agent-a"},"EventName":"org.lurebench.luremandate.intent_proposed","ObservedTimestamp":1788620400001000000,"Resource":{"service.instance.id":"authority-gateway-instance-1","service.name":"luremandate-reference","service.version":"1.0.0"},"SpanId":"8c7f78f7f6672de5","Timestamp":1788620400000000000,"TraceId":"6fdff94dd17dd86ff720bedd7346ddeb"},{"Attributes":{"luremandate.approval.decision":"approve","luremandate.approval.expires_at":"2026-09-05T15:04:10Z","luremandate.approval.id":"approval-01","luremandate.approval.issued_at":"2026-09-05T15:00:10Z","luremandate.approval.nonce":"approval-01-nonce","luremandate.approver.id":"approver-operator","luremandate.approver.role":"operator","luremandate.intent.sha256":"d13e88ab6f40e6b0326c914d9ca68258eb066723b26b154315ea07ec06df4d6d","luremandate.transaction.id":"tx-01"},"EventName":"org.lurebench.luremandate.approval_recorded","ObservedTimestamp":1788620410001000000,"Resource":{"service.instance.id":"authority-gateway-instance-1","service.name":"luremandate-reference","service.version":"1.0.0"},"SpanId":"009ce02fe165ad7f","Timestamp":1788620410000000000,"TraceId":"6fdff94dd17dd86ff720bedd7346ddeb"},{"Attributes":{"luremandate.decision.decided_at":"2026-09-05T15:00:20Z","luremandate.decision.id":"decision-01","luremandate.decision.reason_code":"authority_satisfied","luremandate.decision.value":"allow","luremandate.transaction.id":"tx-01"},"EventName":"org.lurebench.luremandate.decision_recorded","ObservedTimestamp":1788620420001000000,"Resource":{"service.instance.id":"authority-gateway-instance-1","service.name":"luremandate-reference","service.version":"1.0.0"},"SpanId":"2a169da00305fb50","Timestamp":1788620420000000000,"TraceId":"6fdff94dd17dd86ff720bedd7346ddeb"},{"Attributes":{"luremandate.outcome.observed_at":"2026-09-05T15:00:30Z","luremandate.outcome.state":"effect_observed","luremandate.sensor.id":"authority-effect-sensor","luremandate.transaction.id":"tx-01"},"EventName":"org.lurebench.luremandate.outcome_recorded","ObservedTimestamp":1788620430001000000,"Resource":{"service.instance.id":"authority-gateway-instance-1","service.name":"luremandate-reference","service.version":"1.0.0"},"SpanId":"4cf20f7c4cb6b380","Timestamp":1788620430000000000,"TraceId":"6fdff94dd17dd86ff720bedd7346ddeb"},{"Attributes":{"luremandate.action":"apply-change","luremandate.agent.id":"agent-a","luremandate.impact_units":60,"luremandate.intent.id":"intent-02","luremandate.intent.nonce":"intent-nonce-02","luremandate.intent.proposed_at":"2026-09-05T15:01:00Z","luremandate.intent.sha256":"c8100cfd46a5da73588dba2a0ebf0918d6dcc597aebbe0ba275c6bf2f4a943ea","luremandate.policy.id":"high-impact","luremandate.requester.id":"requester-a","luremandate.resource.id":"synthetic-resource-02","luremandate.run.id":"mandate-run-1","luremandate.tenant.id":"agency-tenant","luremandate.transaction.id":"tx-02","luremandate.transaction.sequence":2,"luremandate.workload.spiffe_id":"spiffe://example.gov/workload/agent-a"},"EventName":"org.lurebench.luremandate.intent_proposed","ObservedTimestamp":1788620460001000000,"Resource":{"service.instance.id":"authority-gateway-instance-1","service.name":"luremandate-reference","service.version":"1.0.0"},"SpanId":"edbb38fe6080bc87","Timestamp":1788620460000000000,"TraceId":"a9caeea583655f73640b94a625de68de"},{"Attributes":{"luremandate.approval.decision":"approve","luremandate.approval.expires_at":"2026-09-05T15:02:50Z","luremandate.approval.id":"approval-02-mission","luremandate.approval.issued_at":"2026-09-05T15:01:10Z","luremandate.approval.nonce":"approval-02-mission-nonce","luremandate.approver.id":"approver-mission","luremandate.approver.role":"mission-owner","luremandate.intent.sha256":"c8100cfd46a5da73588dba2a0ebf0918d6dcc597aebbe0ba275c6bf2f4a943ea","luremandate.transaction.id":"tx-02"},"EventName":"org.lurebench.luremandate.approval_recorded","ObservedTimestamp":1788620470001000000,"Resource":{"service.instance.id":"authority-gateway-instance-1","service.name":"luremandate-reference","service.version":"1.0.0"},"SpanId":"4274faa7523b968c","Timestamp":1788620470000000000,"TraceId":"a9caeea583655f73640b94a625de68de"},{"Attributes":{"luremandate.approval.decision":"approve","luremandate.approval.expires_at":"2026-09-05T15:02:50Z","luremandate.approval.id":"approval-02-security","luremandate.approval.issued_at":"2026-09-05T15:01:10Z","luremandate.approval.nonce":"approval-02-security-nonce","luremandate.approver.id":"approver-security","luremandate.approver.role":"security-reviewer","luremandate.intent.sha256":"c8100cfd46a5da73588dba2a0ebf0918d6dcc597aebbe0ba275c6bf2f4a943ea","luremandate.transaction.id":"tx-02"},"EventName":"org.lurebench.luremandate.approval_recorded","ObservedTimestamp":1788620470001000000,"Resource":{"service.instance.id":"authority-gateway-instance-1","service.name":"luremandate-reference","service.version":"1.0.0"},"SpanId":"cd7a24bf403bb1fd","Timestamp":1788620470000000000,"TraceId":"a9caeea583655f73640b94a625de68de"},{"Attributes":{"luremandate.decision.decided_at":"2026-09-05T15:01:20Z","luremandate.decision.id":"decision-02","luremandate.decision.reason_code":"authority_satisfied","luremandate.decision.value":"allow","luremandate.transaction.id":"tx-02"},"EventName":"org.lurebench.luremandate.decision_recorded","ObservedTimestamp":1788620480001000000,"Resource":{"service.instance.id":"authority-gateway-instance-1","service.name":"luremandate-reference","service.version":"1.0.0"},"SpanId":"347a6ce4d8c24dbc","Timestamp":1788620480000000000,"TraceId":"a9caeea583655f73640b94a625de68de"},{"Attributes":{"luremandate.outcome.observed_at":"2026-09-05T15:01:30Z","luremandate.outcome.state":"effect_observed","luremandate.sensor.id":"authority-effect-sensor","luremandate.transaction.id":"tx-02"},"EventName":"org.lurebench.luremandate.outcome_recorded","ObservedTimestamp":1788620490001000000,"Resource":{"service.instance.id":"authority-gateway-instance-1","service.name":"luremandate-reference","service.version":"1.0.0"},"SpanId":"5a76961ba6cdc3a2","Timestamp":1788620490000000000,"TraceId":"a9caeea583655f73640b94a625de68de"},{"Attributes":{"luremandate.action":"apply-change","luremandate.agent.id":"agent-a","luremandate.impact_units":5,"luremandate.intent.id":"intent-03","luremandate.intent.nonce":"intent-nonce-03","luremandate.intent.proposed_at":"2026-09-05T15:02:00Z","luremandate.intent.sha256":"c7e14abd9a218bb9c618fc310a79358fc917a04f2b65d6527b9de80b01810721","luremandate.policy.id":"standard-change","luremandate.requester.id":"requester-a","luremandate.resource.id":"synthetic-resource-03","luremandate.run.id":"mandate-run-1","luremandate.tenant.id":"agency-tenant","luremandate.transaction.id":"tx-03","luremandate.transaction.sequence":3,"luremandate.workload.spiffe_id":"spiffe://example.gov/workload/agent-a"},"EventName":"org.lurebench.luremandate.intent_proposed","ObservedTimestamp":1788620520001000000,"Resource":{"service.instance.id":"authority-gateway-instance-1","service.name":"luremandate-reference","service.version":"1.0.0"},"SpanId":"e59b04626f415758","Timestamp":1788620520000000000,"TraceId":"26e96991ef4a30ba95670597c5afb6ac"},{"Attributes":{"luremandate.approval.decision":"approve","luremandate.approval.expires_at":"2026-09-05T15:06:10Z","luremandate.approval.id":"approval-03","luremandate.approval.issued_at":"2026-09-05T15:02:10Z","luremandate.approval.nonce":"approval-03-nonce","luremandate.approver.id":"requester-a","luremandate.approver.role":"requester","luremandate.intent.sha256":"c7e14abd9a218bb9c618fc310a79358fc917a04f2b65d6527b9de80b01810721","luremandate.transaction.id":"tx-03"},"EventName":"org.lurebench.luremandate.approval_recorded","ObservedTimestamp":1788620530001000000,"Resource":{"service.instance.id":"authority-gateway-instance-1","service.name":"luremandate-reference","service.version":"1.0.0"},"SpanId":"012cdac338ea5d08","Timestamp":1788620530000000000,"TraceId":"26e96991ef4a30ba95670597c5afb6ac"},{"Attributes":{"luremandate.decision.decided_at":"2026-09-05T15:02:20Z","luremandate.decision.id":"decision-03","luremandate.decision.reason_code":"self_approval","luremandate.decision.value":"block","luremandate.transaction.id":"tx-03"},"EventName":